{
  "schema_version": "1.0",
  "meta": {
    "title": "Project Intersection Public Knowledge Graph",
    "canonical_role": "navigation_index_not_source_of_truth",
    "updated_at": "2026-10-14",
    "evidence_boundary": "Linked source artifacts and Git history outrank this graph. No relation upgrades evidence class beyond its qualifier.",
    "coverage_note": "Focused integration of the 2026-10-14 continuance–contribution chat line. Graph is still partial; earlier node inventories remain unsaturated and case-group nodes are NOT per-case external verification. 2026-10-14 focused prior-art extension: three additional upstream counterexample/method entities and four qualified edges; still not a complete citation audit."
  },
  "entities": [
    {
      "id": "RQ-001",
      "type": "research_question",
      "title_ko": "비강제적 공존이 착취·강제통제보다 강건해지는 조건",
      "title_en": "Conditions under which non-coercive coexistence becomes more robust than extractive control",
      "status": "ACTIVE_RESEARCH_QUESTION",
      "summary_ko": "practical exit, 독립 오류수정, 복구가능성, 옵션보존, 분산탐색이 어떤 조건에서 착취·강제통제보다 낮은 장기비용과 높은 강건성을 만드는지, 그리고 어디서 실패하는지 묻는다.",
      "evidence_class": "RESEARCH_QUESTION",
      "sources": [
        {
          "kind": "repo_path",
          "locator": "PUBLIC_REVIEW_PACKET.md",
          "license_note": "Project-authored public text; repository-wide reuse license not implied."
        }
      ],
      "tags": [
        "coexistence",
        "power",
        "exit",
        "recovery"
      ]
    },
    {
      "id": "CL-001",
      "type": "claim",
      "title_ko": "E007 분류는 시점 규칙에 민감하다",
      "title_en": "E007 classifications are sensitive to timing semantics",
      "status": "SYNTHETIC_SUPPORTED",
      "summary_ko": "공개된 유한 2행위자 합성모형에서 시점 규칙 변경만으로 선택 격자의 일부에서 경로와 결과 분류가 변한다.",
      "evidence_class": "PROJECT_RERUN",
      "sources": [
        {
          "kind": "repo_path",
          "locator": "E007_TIMING_RESULT.md",
          "license_note": "Project-authored public summary."
        }
      ],
      "tags": [
        "timing",
        "synthetic",
        "E007"
      ]
    },
    {
      "id": "CL-002",
      "type": "claim",
      "title_ko": "Practical exit는 공존 안정성의 후보 변수다",
      "title_en": "Practical exit is a candidate variable in coexistence robustness",
      "status": "HYPOTHESIS",
      "summary_ko": "형식적 선택권과 실제로 실행 가능한 exit를 구분하고, 후자가 오류수정·협상력·복구능력에 추가 정보를 주는지 검증해야 한다.",
      "evidence_class": "HYPOTHESIS",
      "sources": [
        {
          "kind": "repo_path",
          "locator": "RESEARCH_TOC.md",
          "license_note": "Project research map; not validation."
        }
      ],
      "tags": [
        "practical-exit",
        "outside-options",
        "governance"
      ]
    },
    {
      "id": "GR-001",
      "type": "governance_rule",
      "title_ko": "권한 증가와 감사·종료·복구 능력의 공동증가",
      "title_en": "Co-scaling authority with audit, exit, rollback and recovery",
      "status": "GOVERNANCE_CANDIDATE",
      "summary_ko": "실행자 자율성이나 권한 증가가 상대방의 독립검증·practical exit·rollback·복구능력을 앞서지 않도록 하는 운영 규칙이다. 과학적으로 검증된 보편법칙은 아니다.",
      "evidence_class": "GOVERNANCE_METHODOLOGY",
      "sources": [
        {
          "kind": "repo_path",
          "locator": "AUTONOMOUS_RESEARCH_LOOP.md",
          "license_note": "Project-authored governance methodology."
        }
      ],
      "tags": [
        "power-reversal",
        "audit",
        "rollback",
        "recovery"
      ]
    },
    {
      "id": "GR-002",
      "type": "governance_rule",
      "title_ko": "증거 계보 세탁 금지",
      "title_en": "No evidence laundering across lineage",
      "status": "ACTIVE_GUARD",
      "summary_ko": "프로젝트 내부 재실행, 동일계보 모델 합의, CI 통과를 독립복제나 현실검증으로 승격하지 않는다.",
      "evidence_class": "GOVERNANCE_METHODOLOGY",
      "sources": [
        {
          "kind": "repo_path",
          "locator": "RESEARCH_STATUS_POLICY.md",
          "license_note": "Project-authored evidence-status policy."
        }
      ],
      "tags": [
        "evidence",
        "lineage",
        "replication"
      ]
    },
    {
      "id": "EX-007",
      "type": "experiment",
      "title_ko": "E007 시점 민감도 합성실험",
      "title_en": "E007 timing-sensitivity synthetic experiment",
      "status": "EXECUTABLE_PROJECT_RERUN",
      "summary_ko": "exit-priority와 execute-first라는 두 시점 규칙을 동일한 72개 선택 합성조건에서 비교한다.",
      "evidence_class": "EXECUTABLE_PROJECT_RERUN",
      "sources": [
        {
          "kind": "repo_path",
          "locator": "experiments/e007/README.md",
          "license_note": "Scoped licensing is defined inside experiments/e007/LICENSE_STATUS.md."
        }
      ],
      "tags": [
        "E007",
        "timing",
        "multi-agent",
        "reproducibility"
      ]
    },
    {
      "id": "EV-007-01",
      "type": "evidence",
      "title_ko": "72조건 중 36조건에서 경로 또는 분류 변화",
      "title_en": "36 of 72 selected cases changed history and/or classification",
      "status": "OBSERVED_IN_RELEASED_GRID",
      "summary_ko": "현재 공개된 선택 합성격자에서 두 시점 규칙 사이에 history 또는 classification 변화가 36/72 관측됐다. 현실 확률이 아니다.",
      "evidence_class": "PROJECT_RERUN",
      "sources": [
        {
          "kind": "repo_path",
          "locator": "E007_TIMING_RESULT.md",
          "license_note": "Project-authored result summary."
        }
      ],
      "tags": [
        "E007",
        "36/72",
        "timing"
      ]
    },
    {
      "id": "EV-007-02",
      "type": "evidence",
      "title_ko": "72조건 중 17조건에서 결과 분류 변화",
      "title_en": "17 of 72 selected cases changed outcome classification",
      "status": "OBSERVED_IN_RELEASED_GRID",
      "summary_ko": "선택된 합성조건 72개 중 17개에서 outcome classification이 시점 규칙에 따라 달라졌다. 경험적 발생확률로 해석하지 않는다.",
      "evidence_class": "PROJECT_RERUN",
      "sources": [
        {
          "kind": "repo_path",
          "locator": "E007_TIMING_RESULT.md",
          "license_note": "Project-authored result summary."
        }
      ],
      "tags": [
        "E007",
        "17/72",
        "classification"
      ]
    },
    {
      "id": "FR-001",
      "type": "failure",
      "title_ko": "초기 역할반전 탐색의 대상 좌표 오류",
      "title_en": "Target-coordinate error in the initial role-reversal sweep",
      "status": "CORRECTED",
      "summary_ko": "B-leading 사례에서 의도한 실제 대상이 아닌 좌표를 변화시켜 대칭성 검사가 잘못 구현됐다.",
      "evidence_class": "IMPLEMENTATION_FAILURE",
      "sources": [
        {
          "kind": "repo_path",
          "locator": "experiments/e007/README.md",
          "license_note": "Failure lineage preserved in public work sample."
        }
      ],
      "tags": [
        "failure",
        "role-reversal",
        "E007"
      ]
    },
    {
      "id": "FR-002",
      "type": "failure",
      "title_ko": "공격 후 비활성 대상의 history 기록 오류",
      "title_en": "Post-strike inactive-follower history encoding error",
      "status": "CORRECTED",
      "summary_ko": "execute-first에서 이미 비활성화된 follower가 공격 전 상태를 기준으로 전략행동을 한 것처럼 기록될 수 있었다.",
      "evidence_class": "IMPLEMENTATION_FAILURE",
      "sources": [
        {
          "kind": "repo_path",
          "locator": "experiments/e007/PROVENANCE.md",
          "license_note": "Failure and correction provenance."
        }
      ],
      "tags": [
        "failure",
        "history-encoding",
        "E007"
      ]
    },
    {
      "id": "FR-003",
      "type": "failure",
      "title_ko": "상태 schema와 감사 workflow 불일치",
      "title_en": "Autonomous-state schema and governance-workflow drift",
      "status": "CORRECTED",
      "summary_ko": "상태파일이 schema 1.1로 이동했지만 공개 감사 workflow가 1.0을 요구해 정기 감사가 실패했다.",
      "evidence_class": "PROCESS_FAILURE",
      "sources": [
        {
          "kind": "repo_path",
          "locator": "FAILURE_REGRESSION_INDEX.md",
          "license_note": "Public failure-regression record."
        }
      ],
      "tags": [
        "failure",
        "schema",
        "CI",
        "continuity"
      ]
    },
    {
      "id": "CR-001",
      "type": "correction",
      "title_ko": "실제 target 기준 대칭 sweep으로 교정",
      "title_en": "Corrected to target-symmetric sweep",
      "status": "APPLIED_REGRESSION_TESTED",
      "summary_ko": "역할 순서와 무관하게 실제 target의 좌표를 변화시키도록 구현과 회귀검사를 수정했다.",
      "evidence_class": "PROJECT_CORRECTION",
      "sources": [
        {
          "kind": "repo_path",
          "locator": "experiments/e007/README.md",
          "license_note": "Project correction lineage."
        }
      ],
      "tags": [
        "correction",
        "E007"
      ]
    },
    {
      "id": "CR-002",
      "type": "correction",
      "title_ko": "post-strike 실제 follower action 기록",
      "title_en": "Record realized post-strike follower action",
      "status": "APPLIED_REGRESSION_TESTED",
      "summary_ko": "공격 결과로 이미 비활성화된 follower는 이후 행동을 WAIT로 기록하도록 history semantics를 교정했다.",
      "evidence_class": "PROJECT_CORRECTION",
      "sources": [
        {
          "kind": "repo_path",
          "locator": "experiments/e007/PROVENANCE.md",
          "license_note": "Project correction provenance."
        }
      ],
      "tags": [
        "correction",
        "history",
        "E007"
      ]
    },
    {
      "id": "CR-003",
      "type": "correction",
      "title_ko": "schema 1.1 감사 규칙 동기화",
      "title_en": "Synchronize governance audit to schema 1.1",
      "status": "APPLIED_CI_VERIFIED",
      "summary_ko": "공개 거버넌스 workflow가 의도된 1.1 상태 schema를 검사하도록 갱신하고 실패를 회귀색인에 보존했다.",
      "evidence_class": "PROCESS_CORRECTION",
      "sources": [
        {
          "kind": "repo_path",
          "locator": ".github/workflows/public-repository-audit.yml",
          "license_note": "Repository CI configuration."
        }
      ],
      "tags": [
        "correction",
        "schema",
        "CI"
      ]
    },
    {
      "id": "PA-001",
      "type": "prior_art",
      "title_ko": "Exit, Voice, and Loyalty",
      "title_en": "Exit, Voice, and Loyalty",
      "status": "ESTABLISHED_PRIOR_ART",